{
  "version": "emergency-2025-11-25",
  "updated_at": "2025-11-25",
  "source": "docs/emergency_rules_design.md",
  "rules": [
    {
      "id": "TRR-EM-001",
      "name": "地震人员搜救规则",
      "if": [
        "灾害类型 = earthquake",
        "建筑倒塌 = true",
        "被困人员 >= 1",
        "发生时间 < 72h"
      ],
      "then": [
        "派遣队伍: USAR(地震救援队)",
        "派遣队伍: MEDICAL(医疗急救队)",
        "设置优先级: highest",
        "携带装备: [生命探测仪, 液压破拆, 医疗急救包]"
      ],
      "description": "建筑倒塌后72小时是救援黄金期，需立即派遣专业搜救力量"
    },
    {
      "id": "TRR-EM-002",
      "name": "中型火灾扑救规则",
      "if": [
        "灾害类型 = fire",
        "火势等级 = medium",
        "有人员被困风险 = true"
      ],
      "then": [
        "派遣队伍: FIRE(消防救援队)",
        "派遣数量: 2 消防车",
        "派遣队伍: MEDICAL(医疗急救队)",
        "设置优先级: highest"
      ],
      "description": "中型火灾需2辆消防车配合医疗待命"
    },
    {
      "id": "TRR-EM-003",
      "name": "大型火灾扑救规则",
      "if": [
        "灾害类型 = fire",
        "火势等级 = large",
        "有人员被困风险 = true"
      ],
      "then": [
        "派遣队伍: FIRE(消防救援队)",
        "派遣数量: 4 消防车",
        "派遣队伍: MEDICAL(医疗急救队)",
        "派遣数量: 2 救护车",
        "设置优先级: highest"
      ],
      "description": "大型火灾需4辆消防车和更多医疗资源"
    },
    {
      "id": "TRR-EM-004",
      "name": "特大火灾扑救规则",
      "if": [
        "灾害类型 = fire",
        "火势等级 = critical",
        "有人员被困风险 = true"
      ],
      "then": [
        "派遣队伍: FIRE(消防救援队)",
        "派遣数量: 8 消防车",
        "派遣队伍: MEDICAL(医疗急救队)",
        "派遣数量: 4 救护车",
        "启动: 跨区域增援",
        "设置优先级: highest"
      ],
      "description": "特大火灾需启动跨区域增援"
    },
    {
      "id": "TRR-EM-005",
      "name": "危化品泄漏规则",
      "if": [
        "灾害类型 = hazmat",
        "泄漏状态 = ongoing",
        "化学品毒性 >= medium"
      ],
      "then": [
        "派遣队伍: HAZMAT(危化品处置队)",
        "设立警戒区: 根据扩散模型计算",
        "派遣队伍: MEDICAL(医疗急救队) 待命于安全区",
        "通知部门: [环保, 气象]",
        "设置优先级: highest"
      ],
      "description": "危化品需专业处置，普通救援人员禁止进入"
    },
    {
      "id": "TRR-EM-006",
      "name": "洪涝人员转移规则",
      "if": [
        "灾害类型 = flood",
        "积水深度 >= 0.5m",
        "受困人员 >= 1",
        "水位趋势 = rising"
      ],
      "then": [
        "派遣队伍: WATER(水上救援队)",
        "携带装备: [冲锋舟, 救生衣]",
        "设立转移点: 地势高处或安全建筑",
        "优先转移: [老人, 儿童, 病人, 残疾人, 孕妇]"
      ],
      "description": "水位上涨时需优先转移弱势群体"
    },
    {
      "id": "TRR-EM-007",
      "name": "高层建筑救援规则",
      "if": [
        "灾害类型 in [fire, earthquake]",
        "建筑高度 >= 50m",
        "电梯不可用 = true",
        "被困人员位于高层 = true"
      ],
      "then": [
        "派遣队伍: FIRE(消防救援队) + 云梯车",
        "启用无人机: UAV-001(侦察无人机)",
        "备选方案: 直升机救援",
        "设置优先级: highest"
      ],
      "description": "高层救援需要专用设备和无人机配合"
    },
    {
      "id": "TRR-EM-008",
      "name": "夜间搜救增强规则",
      "if": [
        "时间段 in [18:00-06:00]",
        "搜救任务 = ongoing",
        "可见度 < 100m"
      ],
      "then": [
        "启用设备: UAV-001(热成像模式)",
        "配备照明: 移动照明车",
        "增派人员: 夜间作业经验队伍"
      ],
      "description": "夜间搜救需热成像设备提高效率"
    },
    {
      "id": "TRR-EM-009",
      "name": "道路抢通规则",
      "if": [
        "道路中断 = true",
        "中断原因 in [塌方, 积水, 落石]",
        "该道路为救援必经之路 = true"
      ],
      "then": [
        "派遣队伍: 工程抢修队",
        "携带装备: [挖掘机, 装载机]",
        "先行侦察: 无人机勘察路况",
        "制定绕行方案: 如抢通时间 > 2h"
      ],
      "description": "生命通道必须优先打通"
    },
    {
      "id": "TRR-EM-010",
      "name": "大规模疏散规则",
      "if": [
        "需疏散人数 >= 1000",
        "疏散时限 <= 2h",
        "疏散区域面积 >= 1km²"
      ],
      "then": [
        "启用: UAV-002(喊话无人机) 多架次",
        "派遣: COMMUNITY(社区志愿者)",
        "设立: 多个疏散引导点",
        "协调: [交通管制, 公交转运]"
      ],
      "description": "大规模疏散需立体化引导"
    },
    {
      "id": "TRR-EM-011",
      "name": "电力抢修规则",
      "if": [
        "电力中断 = true",
        "影响区域为: [医院, 学校, 避难所, 指挥中心]"
      ],
      "then": [
        "派遣队伍: POWER(电力抢修队)",
        "携带装备: 发电车",
        "设置优先级: high",
        "临时供电: 重要设施优先"
      ],
      "description": "关键设施电力必须优先恢复"
    },
    {
      "id": "TRR-EM-012",
      "name": "通信恢复规则",
      "if": [
        "通信中断 = true",
        "灾区与外界失联 = true"
      ],
      "then": [
        "派遣队伍: COMM(通信保障队)",
        "携带装备: [卫星通信车, 移动基站]",
        "设置优先级: highest",
        "建立: 临时通信网络"
      ],
      "description": "通信是救援指挥的生命线"
    }
  ]
}
