{
  "version": "docx-2025-11-24",
  "updated_at": "2025-11-24",
  "source": "docs/TO XIAOMA 20251124(2).docx",
  "rules": [
    {
      "id": "TRR-001-001",
      "name": "反隐身空战触发规则",
      "if": [
        "目标类型=空中目标",
        "目标隐身能力=是",
        "目标威胁等级>=高",
        "作战区域=前沿空域"
      ],
      "then": [
        "添加任务：实施进攻性制空作战",
        "设置战术偏好：诱骗雷达开机、多平台无源协同探测、远程静默打击",
        "指定主导平台：有人隐身战斗机",
        "设置成功标准：击落或驱离隐身目标"
      ],
      "description": "发现高威胁隐身空中目标时触发进攻性制空作战，采用反隐身战术。"
    },
    {
      "id": "TRR-001-002",
      "name": "电磁诱骗战术规则",
      "if": [
        "当前任务=实施进攻性制空作战",
        "目标电磁状态=静默",
        "无人机资源可用=是",
        "电磁环境允许=是"
      ],
      "then": [
        "添加原子任务：无人诱饵前出实施电磁诱骗",
        "设置诱骗参数：低截获概率辐射、间歇性开机、模拟有人机特征",
        "指定执行平台：舰载无人诱饵机",
        "设置风险评估：无人机高风险任务"
      ],
      "description": "针对静默隐身目标使用无人诱饵迫使雷达开机。"
    },
    {
      "id": "TRR-001-003",
      "name": "常规空战触发规则",
      "if": [
        "目标类型=空中目标",
        "目标隐身能力=否",
        "目标航向=向我方重要区域",
        "目标速度>400km/h"
      ],
      "then": [
        "添加任务：实施防御性制空作战",
        "设置战术偏好：预警机引导拦截、中距拦射为主、有人机主导交战",
        "指定主导平台：有人三代战斗机",
        "设置成功标准：阻止目标突破防线"
      ],
      "description": "常规非隐身空中目标企图突破防线时触发防御性拦截。"
    },
    {
      "id": "TRR-001-004",
      "name": "水面目标打击规则",
      "if": [
        "目标类型=水面舰艇",
        "舰艇类型 ∈ [驱逐舰, 护卫舰]",
        "目标位置=前沿海域",
        "目标威胁等级>=中"
      ],
      "then": [
        "添加任务：实施对海突击作战",
        "设置战术偏好：协同饱和攻击、防区外发射、多轴向突防",
        "指定攻击平台：有人/无人攻击机混合编组",
        "设置成功标准：摧毁或重创敌水面舰艇"
      ],
      "description": "发现敌水面作战舰艇时触发对海突击。"
    },
    {
      "id": "TRR-001-005",
      "name": "防空压制触发规则",
      "if": [
        "目标类型=地面防空系统",
        "辐射源状态=活跃",
        "威胁范围∩计划航路≠∅",
        "防空系统类型 ∈ [搜索雷达, 制导雷达]"
      ],
      "then": [
        "添加任务：实施防空压制作战",
        "设置战术偏好：诱骗与硬摧毁结合、无人平台前出侦察、反辐射攻击为主",
        "指定主导平台：有人电子战飞机",
        "设置成功标准：压制或摧毁敌防空系统"
      ],
      "description": "活跃防空威胁影响计划航路时触发 SEAD。"
    },
    {
      "id": "TRR-001-006",
      "name": "预警机引导规则",
      "if": [
        "当前任务 ∈ [实施防御性制空作战, 实施进攻性制空作战]",
        "预警机可用=是",
        "探测距离需求>单个平台能力",
        "目标数量>=2"
      ],
      "then": [
        "添加元任务：预警机雷达远程搜索与探测",
        "设置探测参数：全向搜索模式、多目标跟踪、数据链共享",
        "指定平台角色：预警机作为探测核心",
        "设置信息分发：实时共享至所有作战单元"
      ],
      "description": "多目标或超视距作战启用预警机作为探测与分发核心。"
    },
    {
      "id": "TRR-001-007",
      "name": "协同饱和攻击规则",
      "if": [
        "当前任务=实施对海突击作战",
        "目标防御能力=强",
        "可用攻击平台数量>=4",
        "导弹库存充足=是"
      ],
      "then": [
        "设置攻击模式：协同饱和攻击",
        "添加协同任务：多轴向同步攻击、时间协同规划、火力密度最大化",
        "指定协同机制：统一攻击时序控制",
        "设置攻击效果：突破敌舰防空系统"
      ],
      "description": "防御能力强的水面目标采用多平台饱和攻击。"
    },
    {
      "id": "TRR-001-008",
      "name": "电子战协同规则",
      "if": [
        "当前任务 ∈ [实施对海突击作战, 实施防空压制作战]",
        "敌电子对抗强度>=中",
        "电子战平台可用=是",
        "协同时机成熟=是"
      ],
      "then": [
        "添加电子战任务：有人电子战飞机规划干扰",
        "设置协同时序：电子压制先于火力打击",
        "指定干扰参数：定向干扰、欺骗干扰、压制干扰",
        "设置效果评估：敌雷达效能降低"
      ],
      "description": "复杂电磁环境下协调电子压制与火力打击。"
    },
    {
      "id": "TRR-001-009",
      "name": "无人侦察规则",
      "if": [
        "情报需求=高",
        "有人平台风险=高",
        "无人机侦察能力可用=是",
        "侦察区域危险性>=中"
      ],
      "then": [
        "添加侦察任务：无人侦察机前沿侦察",
        "设置侦察模式：隐蔽侦察、持续监视、多传感器融合",
        "指定侦察平台：舰载无人侦察机",
        "设置数据传输：实时回传侦察信息"
      ],
      "description": "高风险区域使用无人侦察降低有人平台风险。"
    },
    {
      "id": "TRR-001-010",
      "name": "远程打击规则",
      "if": [
        "目标防空威胁>=中",
        "防区外武器可用=是",
        "打击精度要求=高",
        "平台生存性优先=是"
      ],
      "then": [
        "设置打击模式：防区外发射",
        "添加打击任务：有人/无人攻击机防区外发射导弹",
        "指定武器选择：远程精确制导武器",
        "设置发射参数：齐射数量、发射间隔、攻击角度"
      ],
      "description": "敌防空威胁存在时采用防区外打击确保平台安全。"
    },
    {
      "id": "TRR-001-011",
      "name": "有人-无人协同规则",
      "if": [
        "作战风险等级>=高",
        "有人-无人平台均可用=是",
        "协同通信正常=是",
        "任务复杂度=高"
      ],
      "then": [
        "设置协同模式：有人机置后指挥，无人机前出作战",
        "添加协同任务：数据链中继、远程控制、信息融合",
        "指定角色分配：有人机决策、无人机执行",
        "设置风险控制：无人机承担主要风险"
      ],
      "description": "高风险任务采用有人-无人协同优化风险分布。"
    },
    {
      "id": "TRR-001-012",
      "name": "效果评估规则",
      "if": [
        "攻击行动完成=是",
        "目标状态不确定=是",
        "评估需求=高",
        "侦察平台可用=是"
      ],
      "then": [
        "添加评估任务：无人侦察机抵近评估",
        "设置评估方法：光学侦察、电磁信号监测、红外特征分析",
        "指定评估标准：目标功能丧失程度",
        "设置再攻击决策：基于评估结果"
      ],
      "description": "攻击后使用无人机评估战果，为后续决策提供依据。"
    }
  ]
}
